{
  "buy_zone_board": [],
  "command_center": {
    "blocked_names": [],
    "needs_review": [
      {
        "blockers": [
          "stale_price",
          "stale_price_blocks_action"
        ],
        "buy_zone_status": "Below Buy Zone",
        "decision": "Starter",
        "model_id": "M13",
        "next_action": "Resolve blockers before proceeding with any decision output.",
        "pipeline_status": "Fail",
        "position_class": "Core/Satellite Starter",
        "risk_score": 4,
        "ticker": "TTEK",
        "valuation_status": "Computed"
      },
      {
        "blockers": [
          "guidance_withdrawn",
          "stale_price"
        ],
        "buy_zone_status": "Below Buy Zone",
        "decision": "Wait",
        "model_id": "M13",
        "next_action": "Resolve blockers before proceeding with any decision output.",
        "pipeline_status": "Fail",
        "position_class": "Speculative Satellite / Wait",
        "risk_score": 7,
        "ticker": "ERII",
        "valuation_status": "Unreliable - Guidance Withdrawn"
      },
      {
        "blockers": [
          "stale_price",
          "stale_price_blocks_action"
        ],
        "buy_zone_status": "Above Buy Zone",
        "decision": "Starter",
        "model_id": "M5",
        "next_action": "Resolve blockers before proceeding with any decision output.",
        "pipeline_status": "Fail",
        "position_class": "Satellite / High-Beta Starter",
        "risk_score": 7,
        "ticker": "SOFI",
        "valuation_status": "Computed"
      },
      {
        "blockers": [
          "stale_price"
        ],
        "buy_zone_status": "Above Buy Zone",
        "decision": "",
        "model_id": "M6",
        "next_action": "Resolve blockers before proceeding with any decision output.",
        "pipeline_status": "Fail",
        "position_class": "",
        "risk_score": null,
        "ticker": "HIMS",
        "valuation_status": "Insufficient Data"
      },
      {
        "blockers": [
          "stale_price"
        ],
        "buy_zone_status": "Above Buy Zone",
        "decision": "",
        "model_id": "M7",
        "next_action": "Resolve blockers before proceeding with any decision output.",
        "pipeline_status": "Fail",
        "position_class": "",
        "risk_score": null,
        "ticker": "NVDA",
        "valuation_status": "Insufficient Data"
      },
      {
        "blockers": [
          "stale_price"
        ],
        "buy_zone_status": "Above Buy Zone",
        "decision": "",
        "model_id": "M14",
        "next_action": "Resolve blockers before proceeding with any decision output.",
        "pipeline_status": "Fail",
        "position_class": "",
        "risk_score": null,
        "ticker": "VST",
        "valuation_status": "Insufficient Data"
      }
    ],
    "top_candidates": []
  },
  "failed": [
    {
      "blockers": [
        "stale_price",
        "stale_price_blocks_action"
      ],
      "buy_zone_status": "Below Buy Zone",
      "decision": "Starter",
      "model_id": "M13",
      "next_action": "Resolve blockers before proceeding with any decision output.",
      "pipeline_status": "Fail",
      "position_class": "Core/Satellite Starter",
      "risk_score": 4,
      "ticker": "TTEK",
      "valuation_status": "Computed"
    },
    {
      "blockers": [
        "guidance_withdrawn",
        "stale_price"
      ],
      "buy_zone_status": "Below Buy Zone",
      "decision": "Wait",
      "model_id": "M13",
      "next_action": "Resolve blockers before proceeding with any decision output.",
      "pipeline_status": "Fail",
      "position_class": "Speculative Satellite / Wait",
      "risk_score": 7,
      "ticker": "ERII",
      "valuation_status": "Unreliable - Guidance Withdrawn"
    },
    {
      "blockers": [
        "stale_price",
        "stale_price_blocks_action"
      ],
      "buy_zone_status": "Above Buy Zone",
      "decision": "Starter",
      "model_id": "M5",
      "next_action": "Resolve blockers before proceeding with any decision output.",
      "pipeline_status": "Fail",
      "position_class": "Satellite / High-Beta Starter",
      "risk_score": 7,
      "ticker": "SOFI",
      "valuation_status": "Computed"
    },
    {
      "blockers": [
        "stale_price"
      ],
      "buy_zone_status": "Above Buy Zone",
      "decision": "",
      "model_id": "M6",
      "next_action": "Resolve blockers before proceeding with any decision output.",
      "pipeline_status": "Fail",
      "position_class": "",
      "risk_score": null,
      "ticker": "HIMS",
      "valuation_status": "Insufficient Data"
    },
    {
      "blockers": [
        "stale_price"
      ],
      "buy_zone_status": "Above Buy Zone",
      "decision": "",
      "model_id": "M7",
      "next_action": "Resolve blockers before proceeding with any decision output.",
      "pipeline_status": "Fail",
      "position_class": "",
      "risk_score": null,
      "ticker": "NVDA",
      "valuation_status": "Insufficient Data"
    },
    {
      "blockers": [
        "stale_price"
      ],
      "buy_zone_status": "Above Buy Zone",
      "decision": "",
      "model_id": "M14",
      "next_action": "Resolve blockers before proceeding with any decision output.",
      "pipeline_status": "Fail",
      "position_class": "",
      "risk_score": null,
      "ticker": "VST",
      "valuation_status": "Insufficient Data"
    }
  ],
  "latest_agent_runs_placeholder": [],
  "needs_audit": [],
  "risk_blocked": [],
  "summary": {
    "fail_count": 6,
    "needs_audit_count": 0,
    "pass_count": 0,
    "risk_blocked_count": 0,
    "total_count": 6,
    "warning_count": 0
  },
  "warnings": []
}
